
<?xml version="1.0" encoding="UTF-8"?>
<xs:schema xmlns:xs="http://www.w3.org/2001/XMLSchema">
  <xs:element name="Hospital">
    <xs:complexType>
      <xs:sequence>
        <xs:element name="Paciente" maxOccurs="unbounded">
          <xs:complexType>
            <xs:sequence>
              <xs:element name="ID" type="xs:int"/>
              <xs:element name="Nombre" type="xs:string"/>
              <xs:element name="Edad" type="xs:int"/>
              <xs:element name="Genero" type="xs:string"/>
              <xs:element name="Diagnostico" type="xs:string"/>
            </xs:sequence>
          </xs:complexType>
        </xs:element>
      </xs:sequence>
    </xs:complexType>
  </xs:element>
</xs:schema>
